{
  "schemaVersion": 1,
  "receiptId": "X51006556809",
  "split": "test",
  "source": {
    "image": "SROIE2019/test/img/X51006556809.jpg",
    "boxes": "SROIE2019/test/box/X51006556809.txt",
    "entities": "SROIE2019/test/entities/X51006556809.txt"
  },
  "status": "unclear",
  "assignments": [
    {
      "id": "a001",
      "label": "TAX",
      "tokenIds": [
        "t0066"
      ],
      "text": "18.84"
    },
    {
      "id": "a002",
      "label": "GRAND_TOTAL",
      "tokenIds": [
        "t0074"
      ],
      "text": "43.36"
    },
    {
      "id": "a003",
      "label": "OTHER",
      "tokenIds": [
        "t0001",
        "t0002",
        "t0003",
        "t0004",
        "t0005",
        "t0006",
        "t0007",
        "t0008",
        "t0009",
        "t0010",
        "t0011",
        "t0012",
        "t0013",
        "t0014",
        "t0015",
        "t0016",
        "t0017",
        "t0018",
        "t0019",
        "t0020",
        "t0021",
        "t0022",
        "t0023",
        "t0024",
        "t0025",
        "t0026",
        "t0027",
        "t0028",
        "t0029",
        "t0030",
        "t0031",
        "t0032",
        "t0033",
        "t0034",
        "t0035",
        "t0036",
        "t0037",
        "t0038",
        "t0039",
        "t0040",
        "t0041",
        "t0042",
        "t0043",
        "t0044",
        "t0045",
        "t0046",
        "t0047",
        "t0048",
        "t0049",
        "t0050",
        "t0051",
        "t0052",
        "t0053",
        "t0054",
        "t0055",
        "t0056",
        "t0057",
        "t0058",
        "t0059",
        "t0060",
        "t0061",
        "t0062",
        "t0063",
        "t0064",
        "t0065",
        "t0067",
        "t0068",
        "t0069",
        "t0070",
        "t0071",
        "t0072",
        "t0073",
        "t0075",
        "t0076",
        "t0077",
        "t0078",
        "t0079",
        "t0080",
        "t0081",
        "t0082",
        "t0083",
        "t0084",
        "t0085",
        "t0086"
      ],
      "text": "GARDENIA BAKERIES (KL) SDN BHD (139386 X) LOT 3, JALAN PELABUR 23/1, 40300 SHAH ALAM, SELANGOR. TEL: 03- 55423228 GST ID: 000381399040 TAX INVOICE / ADJUSTMENT NOTE CASH INV NO.: 7921F714 VE DATE: 21/09/2017 MAKASSAR FRESH MARKET SDN BHD GROUND FLOOR, NO. 4 & 6, JALAN SS 15/4B, 47500 SUBANG JAYA, SELANGOR VE05: RIDZUAN (11900) DD: 21/09/2017 12:28 DESCRIPTION U.P D AMT(RM) O.C. WHITE 2.13 2 2 0 0 0.00 WHOLEMEAL 2.78 2 0 0 2 5.56 O.C JUMBO 2.97 6 0 0 6 17.82 TOTAL 0% SUPPLIES: 23.38 DELICIA-B/SCOTCH 3.72 2 0 0 2 7.44 CR-CORN 0.72 30 6 0 24 17.28 SQ-CHOCMLT 0.84 0 7 0 -7 -5.88 TOTAL 6% SUPPLIES (EXCL. GST): GST: 1.14 TOTAL 6% SUPPLIES (INC. GST): 19.98 TOTAL 0% SUPPLIES: 23.38 TOTAL PAYABLE: E.&.0.E. RECEIVED ABOVE GOODS IN GOOD ORDER CONDITION. THE RECIPIENT OF GARDENIA'S PRODUCTS IS REQUIRED TO MAKE NECESSARY ADJUSTMENTS TO ITS INPUT TAX CLAIMS, ON THE BASIC OF THE ADJUSTMENTS SHOWN IN THIS TAX INVOICE / ADJUSTMENT NOTE RE- PRINT ISS EXC SALE FAX:03- 55423213"
    }
  ],
  "items": [],
  "notes": "Geometry-and-math assisted annotation generated from original OCR boxes; no OCR text was invented. 0 item group(s); 0/0 item equations valid. lineSum=0.00; subtotal=missing; grandTotal=43.36. Needs human review because layout or totals were ambiguous.",
  "createdAt": "2026-09-11T00:44:25.213Z",
  "updatedAt": "2026-09-11T00:44:25.213Z"
}
