{
  "schemaVersion": 1,
  "receiptId": "X51006414703",
  "split": "train",
  "source": {
    "image": "SROIE2019/train/img/X51006414703.jpg",
    "boxes": "SROIE2019/train/box/X51006414703.txt",
    "entities": "SROIE2019/train/entities/X51006414703.txt"
  },
  "status": "unclear",
  "assignments": [
    {
      "id": "a001",
      "label": "TAX",
      "tokenIds": [
        "t0038"
      ],
      "text": "-0.02"
    },
    {
      "id": "a002",
      "label": "GRAND_TOTAL",
      "tokenIds": [
        "t0040"
      ],
      "text": "98.35"
    },
    {
      "id": "a003",
      "label": "OTHER",
      "tokenIds": [
        "t0001",
        "t0002",
        "t0003",
        "t0004",
        "t0005",
        "t0006",
        "t0007",
        "t0008",
        "t0009",
        "t0010",
        "t0011",
        "t0012",
        "t0013",
        "t0014",
        "t0015",
        "t0016",
        "t0017",
        "t0018",
        "t0019",
        "t0020",
        "t0021",
        "t0022",
        "t0023",
        "t0024",
        "t0025",
        "t0026",
        "t0027",
        "t0028",
        "t0029",
        "t0030",
        "t0031",
        "t0032",
        "t0033",
        "t0034",
        "t0035",
        "t0036",
        "t0037",
        "t0039",
        "t0041",
        "t0042",
        "t0043",
        "t0044",
        "t0045",
        "t0046",
        "t0047",
        "t0048",
        "t0049",
        "t0050",
        "t0051",
        "t0052",
        "t0053",
        "t0054",
        "t0055",
        "t0056",
        "t0057",
        "t0058",
        "t0059",
        "t0060",
        "t0061",
        "t0062",
        "t0063",
        "t0064",
        "t0065",
        "t0066",
        "t0067",
        "t0068"
      ],
      "text": "AEON CO. (M) BHD (126926-H) 3RD FLR, AEON TAMAN MALURI SC JLN JEJAKA, TAMAN MALURI CHERAS, 55100 KUALA LUMPUR GST ID : 002017394688 SHOPPING HOURS SUN-THU:1000 HRS - 2230 HRS FRI-SAT:1000 HRS - 2300 HRS 1X 14.99SR KIT KAT SHARE B ITEM PROMO @9.99 -5.00 1X 21.10SR BERYLS TTOW 1X 18.29SR VH BOX 180G SE ITEM PROMO @12.89 -5.40 1X 18.29SR VH BOX 180G RA ITEM PROMO @12.89 -5.40 1X 31.60SR LINDT DT125 1X 9.90SR MILO NUGGETS FU SUB-TOTAL 98.37 TOTAL SALES INCL GST 98.37 ROUNDING ADJ TOTAL AFTER ADJ INCL GST CASH 100.00 ITEM COUNT 6 CHANGE AMT 1.65 INVOICE NO: 2018042210100080567 GST SUMMARY AMOUNT TAX SR @ 6% 92.80 5.57 TOTAL 92.80 5.57 22/04/2018 19:26 1010 008 0080567 0307614 PJ HAZIQ AEON PERMAS JAYA TEL 1-300-80-AEON (2366) THANK YOU FOR YOUR PATRONAGE PLEASE COME AGAIN 000008204363 000001018506 000001057437 000001057436 000001011536 000005914876"
    }
  ],
  "items": [],
  "notes": "Geometry-and-math assisted annotation generated from original OCR boxes; no OCR text was invented. 0 item group(s); 0/0 item equations valid. lineSum=0.00; subtotal=missing; grandTotal=98.35. Needs human review because layout or totals were ambiguous.",
  "createdAt": "2026-09-11T00:44:29.096Z",
  "updatedAt": "2026-09-11T00:44:29.096Z"
}
