{
  "schemaVersion": 1,
  "receiptId": "X51006466778",
  "split": "train",
  "source": {
    "image": "SROIE2019/train/img/X51006466778.jpg",
    "boxes": "SROIE2019/train/box/X51006466778.txt",
    "entities": "SROIE2019/train/entities/X51006466778.txt"
  },
  "status": "unclear",
  "assignments": [
    {
      "id": "a001",
      "label": "SUBTOTAL",
      "tokenIds": [
        "t0026"
      ],
      "text": "RM20.40"
    },
    {
      "id": "a002",
      "label": "OTHER",
      "tokenIds": [
        "t0001",
        "t0002",
        "t0003",
        "t0004",
        "t0005",
        "t0006",
        "t0007",
        "t0008",
        "t0009",
        "t0010",
        "t0011",
        "t0012",
        "t0013",
        "t0014",
        "t0015",
        "t0016",
        "t0017",
        "t0018",
        "t0019",
        "t0020",
        "t0021",
        "t0022",
        "t0023",
        "t0024",
        "t0025",
        "t0027",
        "t0028",
        "t0029",
        "t0030",
        "t0031",
        "t0032",
        "t0033"
      ],
      "text": "3180502 THE ROTI MAN BAKERY 000965911·P 117, JALAN RADIN BAGUS, SRI PETALING TEL:03-9054 3785 GST 000292065280 MC #01 REG C01 04-05-2018 16:07 456277 BACON RM4.90 S WALNUT RAISIN RM8.60 S DARK RYE BUN RM6.90 S 3 NO SUBTOTAL CASH RM20.40 TAX INVOICE NO. 223894 THANK YOU PLEASE COME AGAIN PRICE INCLSIVE 6% GST"
    }
  ],
  "items": [],
  "notes": "Geometry-and-math assisted annotation generated from original OCR boxes; no OCR text was invented. 0 item group(s); 0/0 item equations valid. lineSum=0.00; subtotal=20.4; grandTotal=missing. Needs human review because layout or totals were ambiguous.",
  "createdAt": "2026-09-11T00:44:29.243Z",
  "updatedAt": "2026-09-11T00:44:29.243Z"
}
