{
  "schemaVersion": 1,
  "receiptId": "X51006008082",
  "split": "test",
  "source": {
    "image": "SROIE2019/test/img/X51006008082.jpg",
    "boxes": "SROIE2019/test/box/X51006008082.txt",
    "entities": "SROIE2019/test/entities/X51006008082.txt"
  },
  "status": "unclear",
  "assignments": [
    {
      "id": "a001",
      "label": "ITEM_NAME",
      "tokenIds": [
        "t0021"
      ],
      "text": "BANNER 8X4FEET",
      "itemId": "item-001"
    },
    {
      "id": "a002",
      "label": "QUANTITY",
      "tokenIds": [
        "t0029"
      ],
      "text": "1",
      "itemId": "item-001"
    },
    {
      "id": "a003",
      "label": "UNIT_PRICE",
      "tokenIds": [
        "t0037"
      ],
      "text": "28.58",
      "itemId": "item-001"
    },
    {
      "id": "a004",
      "label": "LINE_TOTAL",
      "tokenIds": [
        "t0045"
      ],
      "text": "28.58",
      "itemId": "item-001"
    },
    {
      "id": "a005",
      "label": "ITEM_NAME",
      "tokenIds": [
        "t0022"
      ],
      "text": "DESIGN BANNER",
      "itemId": "item-002"
    },
    {
      "id": "a006",
      "label": "QUANTITY",
      "tokenIds": [
        "t0030"
      ],
      "text": "1",
      "itemId": "item-002"
    },
    {
      "id": "a007",
      "label": "UNIT_PRICE",
      "tokenIds": [
        "t0038"
      ],
      "text": "31.80",
      "itemId": "item-002"
    },
    {
      "id": "a008",
      "label": "LINE_TOTAL",
      "tokenIds": [
        "t0046"
      ],
      "text": "31.80",
      "itemId": "item-002"
    },
    {
      "id": "a009",
      "label": "ITEM_NAME",
      "tokenIds": [
        "t0023"
      ],
      "text": "BUSINESS SPOT UV",
      "itemId": "item-003"
    },
    {
      "id": "a010",
      "label": "QUANTITY",
      "tokenIds": [
        "t0031"
      ],
      "text": "1",
      "itemId": "item-003"
    },
    {
      "id": "a011",
      "label": "UNIT_PRICE",
      "tokenIds": [
        "t0039"
      ],
      "text": "159.00",
      "itemId": "item-003"
    },
    {
      "id": "a012",
      "label": "LINE_TOTAL",
      "tokenIds": [
        "t0047"
      ],
      "text": "159.00",
      "itemId": "item-003"
    },
    {
      "id": "a013",
      "label": "ITEM_NAME",
      "tokenIds": [
        "t0024"
      ],
      "text": "DIE-CUT TRANSPARENT PP S",
      "itemId": "item-004"
    },
    {
      "id": "a014",
      "label": "QUANTITY",
      "tokenIds": [
        "t0032"
      ],
      "text": "5",
      "itemId": "item-004"
    },
    {
      "id": "a015",
      "label": "UNIT_PRICE",
      "tokenIds": [
        "t0040"
      ],
      "text": "12.40",
      "itemId": "item-004"
    },
    {
      "id": "a016",
      "label": "LINE_TOTAL",
      "tokenIds": [
        "t0048"
      ],
      "text": "62.01",
      "itemId": "item-004"
    },
    {
      "id": "a017",
      "label": "ITEM_NAME",
      "tokenIds": [
        "t0025"
      ],
      "text": "DESIGN STICKER",
      "itemId": "item-005"
    },
    {
      "id": "a018",
      "label": "QUANTITY",
      "tokenIds": [
        "t0033"
      ],
      "text": "1",
      "itemId": "item-005"
    },
    {
      "id": "a019",
      "label": "UNIT_PRICE",
      "tokenIds": [
        "t0041"
      ],
      "text": "31.80",
      "itemId": "item-005"
    },
    {
      "id": "a020",
      "label": "LINE_TOTAL",
      "tokenIds": [
        "t0049"
      ],
      "text": "31.80",
      "itemId": "item-005"
    },
    {
      "id": "a021",
      "label": "ITEM_NAME",
      "tokenIds": [
        "t0026"
      ],
      "text": "T SHIRT PRINTING",
      "itemId": "item-006"
    },
    {
      "id": "a022",
      "label": "QUANTITY",
      "tokenIds": [
        "t0034"
      ],
      "text": "5",
      "itemId": "item-006"
    },
    {
      "id": "a023",
      "label": "UNIT_PRICE",
      "tokenIds": [
        "t0042"
      ],
      "text": "11.13",
      "itemId": "item-006"
    },
    {
      "id": "a024",
      "label": "LINE_TOTAL",
      "tokenIds": [
        "t0050"
      ],
      "text": "55.65",
      "itemId": "item-006"
    },
    {
      "id": "a025",
      "label": "ITEM_NAME",
      "tokenIds": [
        "t0027"
      ],
      "text": "DEPOSIT (CS00530344)",
      "itemId": "item-007"
    },
    {
      "id": "a026",
      "label": "QUANTITY",
      "tokenIds": [
        "t0035"
      ],
      "text": "1",
      "itemId": "item-007"
    },
    {
      "id": "a027",
      "label": "UNIT_PRICE",
      "tokenIds": [
        "t0043"
      ],
      "text": "-200.00",
      "itemId": "item-007"
    },
    {
      "id": "a028",
      "label": "LINE_TOTAL",
      "tokenIds": [
        "t0051"
      ],
      "text": "-200.00",
      "itemId": "item-007"
    },
    {
      "id": "a029",
      "label": "ITEM_NAME",
      "tokenIds": [
        "t0028"
      ],
      "text": "BANNER 8 X 4",
      "itemId": "item-008"
    },
    {
      "id": "a030",
      "label": "QUANTITY",
      "tokenIds": [
        "t0036"
      ],
      "text": "1",
      "itemId": "item-008"
    },
    {
      "id": "a031",
      "label": "UNIT_PRICE",
      "tokenIds": [
        "t0044"
      ],
      "text": "35.36",
      "itemId": "item-008"
    },
    {
      "id": "a032",
      "label": "LINE_TOTAL",
      "tokenIds": [
        "t0052"
      ],
      "text": "35.36",
      "itemId": "item-008"
    },
    {
      "id": "a033",
      "label": "ITEM_NAME",
      "tokenIds": [
        "t0065"
      ],
      "text": "TOTAL.",
      "itemId": "item-009"
    },
    {
      "id": "a034",
      "label": "QUANTITY",
      "tokenIds": [
        "t0066"
      ],
      "text": "16",
      "itemId": "item-009"
    },
    {
      "id": "a035",
      "label": "LINE_TOTAL",
      "tokenIds": [
        "t0067"
      ],
      "text": "204.20",
      "itemId": "item-009"
    },
    {
      "id": "a036",
      "label": "SERVICE_CHARGE",
      "tokenIds": [
        "t0078"
      ],
      "text": "0.00"
    },
    {
      "id": "a037",
      "label": "TAX",
      "tokenIds": [
        "t0076"
      ],
      "text": "192.64"
    },
    {
      "id": "a038",
      "label": "DISCOUNT",
      "tokenIds": [
        "t0077"
      ],
      "text": "0.00"
    },
    {
      "id": "a039",
      "label": "ROUNDING",
      "tokenIds": [
        "t0080"
      ],
      "text": "0.00"
    },
    {
      "id": "a040",
      "label": "GRAND_TOTAL",
      "tokenIds": [
        "t0082"
      ],
      "text": "204.20"
    },
    {
      "id": "a041",
      "label": "OTHER",
      "tokenIds": [
        "t0001",
        "t0002",
        "t0003",
        "t0004",
        "t0005",
        "t0006",
        "t0007",
        "t0008",
        "t0009",
        "t0010",
        "t0011",
        "t0012",
        "t0013",
        "t0014",
        "t0015",
        "t0016",
        "t0017",
        "t0018",
        "t0019",
        "t0020",
        "t0053",
        "t0054",
        "t0055",
        "t0056",
        "t0057",
        "t0058",
        "t0059",
        "t0060",
        "t0061",
        "t0062",
        "t0063",
        "t0064",
        "t0068",
        "t0069",
        "t0070",
        "t0071",
        "t0072",
        "t0073",
        "t0074",
        "t0075",
        "t0079",
        "t0081",
        "t0083",
        "t0084",
        "t0085",
        "t0086",
        "t0087",
        "t0088",
        "t0089",
        "t0090",
        "t0091",
        "t0092",
        "t0093",
        "t0094",
        "t0095",
        "t0096",
        "t0097",
        "t0098",
        "t0099"
      ],
      "text": "PRINT EXPERT SDN BHD (989625-A) NO 18, 20, 22, JALAN BUNGA TANJONG 2/16, 40000 SHAH ALAM, SELANGOR TEL : 03-55250588 GST ID : 000886677504 TAX INVOICE RECEIPT #: STAFF: CASHIER: CS00534185 SYAHID USER TABLE: DATE: TIME: 92 25/03/2018 15:17:00 DESCRIPTION SR SR SR SR SR SR SR SR QTY PRICE AMT TAX TOTAL SALES (EXCLUDING GST) : DISCOUNT : SERVICE CHARGE : TOTAL GST : ROUNDING : TOTAL SALES (INCLUSIVE OF GST) {41005926} VISA CHANGE 11.56 204.20 0.00 GST SUMMARY TAX CODE SR % 6 TOTAL : AMT (RM) 192.64 192.64 TAX (RM) 11.56 11.56 # INDICATED THIS TAX CODE BELONG TO SERVICE CHARGES. GOODS SOLD ARE NOT RETURNABLE, ITEM NOT LECTED MORE THAN 1 MONTH WILL BE DISPOSED"
    }
  ],
  "items": [
    {
      "id": "item-001",
      "assignmentIds": [
        "a001",
        "a002",
        "a003",
        "a004"
      ]
    },
    {
      "id": "item-002",
      "assignmentIds": [
        "a005",
        "a006",
        "a007",
        "a008"
      ]
    },
    {
      "id": "item-003",
      "assignmentIds": [
        "a009",
        "a010",
        "a011",
        "a012"
      ]
    },
    {
      "id": "item-004",
      "assignmentIds": [
        "a013",
        "a014",
        "a015",
        "a016"
      ]
    },
    {
      "id": "item-005",
      "assignmentIds": [
        "a017",
        "a018",
        "a019",
        "a020"
      ]
    },
    {
      "id": "item-006",
      "assignmentIds": [
        "a021",
        "a022",
        "a023",
        "a024"
      ]
    },
    {
      "id": "item-007",
      "assignmentIds": [
        "a025",
        "a026",
        "a027",
        "a028"
      ]
    },
    {
      "id": "item-008",
      "assignmentIds": [
        "a029",
        "a030",
        "a031",
        "a032"
      ]
    },
    {
      "id": "item-009",
      "assignmentIds": [
        "a033",
        "a034",
        "a035"
      ]
    }
  ],
  "notes": "Geometry-and-math assisted annotation generated from original OCR boxes; no OCR text was invented. 9 item group(s); 8/9 item equations valid. lineSum=408.40; subtotal=missing; grandTotal=204.2. Needs human review because layout or totals were ambiguous.",
  "createdAt": "2026-09-11T00:44:24.514Z",
  "updatedAt": "2026-09-11T00:44:24.514Z"
}
