{
  "schemaVersion": 1,
  "receiptId": "X51006387932",
  "split": "train",
  "source": {
    "image": "SROIE2019/train/img/X51006387932.jpg",
    "boxes": "SROIE2019/train/box/X51006387932.txt",
    "entities": "SROIE2019/train/entities/X51006387932.txt"
  },
  "status": "unclear",
  "assignments": [
    {
      "id": "a001",
      "label": "ITEM_NAME",
      "tokenIds": [
        "t0024"
      ],
      "text": "5001 BAKERY DEEP TRAY(18 14 8CM)KT",
      "itemId": "item-001"
    },
    {
      "id": "a002",
      "label": "QUANTITY",
      "tokenIds": [
        "t0021"
      ],
      "text": "1",
      "itemId": "item-001"
    },
    {
      "id": "a003",
      "label": "UNIT_PRICE",
      "tokenIds": [
        "t0022"
      ],
      "text": "12.00",
      "itemId": "item-001"
    },
    {
      "id": "a004",
      "label": "LINE_TOTAL",
      "tokenIds": [
        "t0023"
      ],
      "text": "12.00",
      "itemId": "item-001"
    },
    {
      "id": "a005",
      "label": "ITEM_NAME",
      "tokenIds": [
        "t0025"
      ],
      "text": "TOTAL",
      "itemId": "item-002"
    },
    {
      "id": "a006",
      "label": "LINE_TOTAL",
      "tokenIds": [
        "t0030"
      ],
      "text": "12.00",
      "itemId": "item-002"
    },
    {
      "id": "a007",
      "label": "GRAND_TOTAL",
      "tokenIds": [
        "t0032"
      ],
      "text": "12.00"
    },
    {
      "id": "a008",
      "label": "DISCOUNT",
      "tokenIds": [
        "t0031"
      ],
      "text": "0.00"
    },
    {
      "id": "a009",
      "label": "OTHER",
      "tokenIds": [
        "t0001",
        "t0002",
        "t0003",
        "t0004",
        "t0005",
        "t0006",
        "t0007",
        "t0008",
        "t0009",
        "t0010",
        "t0011",
        "t0012",
        "t0013",
        "t0014",
        "t0015",
        "t0016",
        "t0017",
        "t0018",
        "t0019",
        "t0020",
        "t0026",
        "t0027",
        "t0028",
        "t0029",
        "t0033",
        "t0034",
        "t0035",
        "t0036",
        "t0037",
        "t0038",
        "t0039",
        "t0040",
        "t0041",
        "t0042",
        "t0043",
        "t0044",
        "t0045"
      ],
      "text": "BILLION SIX ENTERPRISE NO 3, JALAN TAMAN JASA 2, SECTION U6, 40150 SHAH ALAM. TEL : 603-58856749 GST REG NO: 000944312320 TAX INVOICE POSTED INVOICE NO : 01 148409 DATE CASHIER : 04/05/2017 7:19:43 AM : 123 DESCRIPTION QTY PRICE AMOUNT 1 SR 9555255201883 DISCOUNT: TOTAL SALES INCLUSIVE GST @6.00% CASH RECEIVED : CHANGE 50.00 38.00 GST SUMMARY % AMOUNT(RM) TAX(RM) SR 0.00 11.32 0.68 BARANG YANG SUDAH CH BEH, WANG HDAK DAPAT DI KEMBAHKAN PERTUKARAN BARANG HANYA BOLEH DIBUAT DALAM 3 HAN SAHAJA DENGAN RESIT"
    }
  ],
  "items": [
    {
      "id": "item-001",
      "assignmentIds": [
        "a001",
        "a002",
        "a003",
        "a004"
      ]
    },
    {
      "id": "item-002",
      "assignmentIds": [
        "a005",
        "a006"
      ]
    }
  ],
  "notes": "Geometry-and-math assisted annotation generated from original OCR boxes; no OCR text was invented. 2 item group(s); 1/2 item equations valid. lineSum=24.00; subtotal=missing; grandTotal=12. Needs human review because layout or totals were ambiguous.",
  "createdAt": "2026-09-11T00:44:28.743Z",
  "updatedAt": "2026-09-11T00:44:28.743Z"
}
