{
  "schemaVersion": 1,
  "receiptId": "X51006414712",
  "split": "train",
  "source": {
    "image": "SROIE2019/train/img/X51006414712.jpg",
    "boxes": "SROIE2019/train/box/X51006414712.txt",
    "entities": "SROIE2019/train/entities/X51006414712.txt"
  },
  "status": "unclear",
  "assignments": [
    {
      "id": "a001",
      "label": "ITEM_NAME",
      "tokenIds": [
        "t0024"
      ],
      "text": "PLSB-R",
      "itemId": "item-001"
    },
    {
      "id": "a002",
      "label": "QUANTITY",
      "tokenIds": [
        "t0023"
      ],
      "text": "1",
      "itemId": "item-001"
    },
    {
      "id": "a003",
      "label": "LINE_TOTAL",
      "tokenIds": [
        "t0025"
      ],
      "text": "0.20",
      "itemId": "item-001"
    },
    {
      "id": "a004",
      "label": "ITEM_NAME",
      "tokenIds": [
        "t0028",
        "t0027"
      ],
      "text": "AOA4-ADI RCD",
      "itemId": "item-002"
    },
    {
      "id": "a005",
      "label": "QUANTITY",
      "tokenIds": [
        "t0026"
      ],
      "text": "1",
      "itemId": "item-002"
    },
    {
      "id": "a006",
      "label": "LINE_TOTAL",
      "tokenIds": [
        "t0029"
      ],
      "text": "14.50",
      "itemId": "item-002"
    },
    {
      "id": "a007",
      "label": "ITEM_NAME",
      "tokenIds": [
        "t0033",
        "t0032",
        "t0031"
      ],
      "text": "LVDR-RG-1 (CAN) PEP",
      "itemId": "item-003"
    },
    {
      "id": "a008",
      "label": "QUANTITY",
      "tokenIds": [
        "t0030"
      ],
      "text": "1",
      "itemId": "item-003"
    },
    {
      "id": "a009",
      "label": "LINE_TOTAL",
      "tokenIds": [
        "t0034"
      ],
      "text": "3.50",
      "itemId": "item-003"
    },
    {
      "id": "a010",
      "label": "ITEM_NAME",
      "tokenIds": [
        "t0038",
        "t0037",
        "t0036"
      ],
      "text": "LVDR-RG-1 (CAN) PEP",
      "itemId": "item-004"
    },
    {
      "id": "a011",
      "label": "QUANTITY",
      "tokenIds": [
        "t0035"
      ],
      "text": "1",
      "itemId": "item-004"
    },
    {
      "id": "a012",
      "label": "LINE_TOTAL",
      "tokenIds": [
        "t0039"
      ],
      "text": "3.50",
      "itemId": "item-004"
    },
    {
      "id": "a013",
      "label": "ITEM_NAME",
      "tokenIds": [
        "t0042",
        "t0041"
      ],
      "text": "LVDR-RG-1 T/B",
      "itemId": "item-005"
    },
    {
      "id": "a014",
      "label": "QUANTITY",
      "tokenIds": [
        "t0040"
      ],
      "text": "1",
      "itemId": "item-005"
    },
    {
      "id": "a015",
      "label": "LINE_TOTAL",
      "tokenIds": [
        "t0043"
      ],
      "text": "7.50",
      "itemId": "item-005"
    },
    {
      "id": "a016",
      "label": "ITEM_NAME",
      "tokenIds": [
        "t0047",
        "t0045",
        "t0046"
      ],
      "text": "LVDR-RG-1 9\"HT (AC)",
      "itemId": "item-006"
    },
    {
      "id": "a017",
      "label": "QUANTITY",
      "tokenIds": [
        "t0044"
      ],
      "text": "1",
      "itemId": "item-006"
    },
    {
      "id": "a018",
      "label": "LINE_TOTAL",
      "tokenIds": [
        "t0048"
      ],
      "text": "27.80",
      "itemId": "item-006"
    },
    {
      "id": "a019",
      "label": "ITEM_NAME",
      "tokenIds": [
        "t0051",
        "t0053"
      ],
      "text": "TOTAL ITEMS SUB-TOTAL",
      "itemId": "item-007"
    },
    {
      "id": "a020",
      "label": "LINE_TOTAL",
      "tokenIds": [
        "t0055"
      ],
      "text": "57.00",
      "itemId": "item-007"
    },
    {
      "id": "a021",
      "label": "TAX",
      "tokenIds": [
        "t0070"
      ],
      "text": "2.24"
    },
    {
      "id": "a022",
      "label": "DISCOUNT",
      "tokenIds": [
        "t0058"
      ],
      "text": "17.40"
    },
    {
      "id": "a023",
      "label": "GRAND_TOTAL",
      "tokenIds": [
        "t0061"
      ],
      "text": "39.60"
    },
    {
      "id": "a024",
      "label": "OTHER",
      "tokenIds": [
        "t0001",
        "t0002",
        "t0003",
        "t0004",
        "t0005",
        "t0006",
        "t0007",
        "t0008",
        "t0009",
        "t0010",
        "t0011",
        "t0012",
        "t0013",
        "t0014",
        "t0015",
        "t0016",
        "t0017",
        "t0018",
        "t0019",
        "t0020",
        "t0021",
        "t0022",
        "t0049",
        "t0050",
        "t0052",
        "t0054",
        "t0056",
        "t0057",
        "t0059",
        "t0060",
        "t0062",
        "t0063",
        "t0064",
        "t0065",
        "t0066",
        "t0067",
        "t0068",
        "t0069",
        "t0071",
        "t0072",
        "t0073",
        "t0074",
        "t0075",
        "t0076",
        "t0077",
        "t0078",
        "t0079",
        "t0080",
        "t0081",
        "t0082",
        "t0083",
        "t0084",
        "t0085",
        "t0086",
        "t0087",
        "t0088",
        "t0089"
      ],
      "text": "TAX INVOICE DOMINO'S PIZZA GST REF NO : 001694261248 DOMINO'S PIZZA TAMAN UNIVERSITI 30, JLN KEBUDAYAAN 7, TMN UNIVERSITI 81300 SKUDAI, JOHOR CARRY OUT NOW PAY BY : CASH ORDER : 8557 BY : 5586 ORDER TIME : 13:19:29 DATE : 28/04/18 NAME: MS NIWA PICKUP TIME: 13:34:29 QTY MENU DESC COUPON DISC PRICE 17.40 57.00 : : COUPON DISCOUNT : GRAND TOTAL : PAYMENT : 40.00 CHANGE DUE : 00.40 *6% GST INCLUDED : SUPPORT OUR SMILE CAMPAIGN : ) DID WE SMILE AT YOU? LET US KNOW AT WWW.DOMINOS.COM.MY/SMILE AND RECEIVE A 30% OFF SIDE ITEM E-COUPON UPON SURVEY SUBMISSION SURVEY CODE: CBD280740855719 THANK YOU FOR VISITING DOMINO'S. PLEASE COME AGAIN! 1 - 3 0 0 - 8 8 8 - 3 3 3 WWW.DOMINOS.COM.MY WE ARE COMPLIANT TO THE PDPA 2010. VISIT WWW.DOMINOS.COM.MY/TERMS TO VIEW OUR PERSONAL DATE PROTECTION POLICY. OWNED BY DOMMAL FOOD SERVICES SDN BHD CO. NO. 41906-A 1"
    }
  ],
  "items": [
    {
      "id": "item-001",
      "assignmentIds": [
        "a001",
        "a002",
        "a003"
      ]
    },
    {
      "id": "item-002",
      "assignmentIds": [
        "a004",
        "a005",
        "a006"
      ]
    },
    {
      "id": "item-003",
      "assignmentIds": [
        "a007",
        "a008",
        "a009"
      ]
    },
    {
      "id": "item-004",
      "assignmentIds": [
        "a010",
        "a011",
        "a012"
      ]
    },
    {
      "id": "item-005",
      "assignmentIds": [
        "a013",
        "a014",
        "a015"
      ]
    },
    {
      "id": "item-006",
      "assignmentIds": [
        "a016",
        "a017",
        "a018"
      ]
    },
    {
      "id": "item-007",
      "assignmentIds": [
        "a019",
        "a020"
      ]
    }
  ],
  "notes": "Geometry-and-math assisted annotation generated from original OCR boxes; no OCR text was invented. 7 item group(s); 0/7 item equations valid. lineSum=114.00; subtotal=missing; grandTotal=39.6. Needs human review because layout or totals were ambiguous.",
  "createdAt": "2026-09-11T00:44:29.116Z",
  "updatedAt": "2026-09-11T00:44:29.116Z"
}
