{
  "schemaVersion": 1,
  "receiptId": "X51005675099",
  "split": "test",
  "source": {
    "image": "SROIE2019/test/img/X51005675099.jpg",
    "boxes": "SROIE2019/test/box/X51005675099.txt",
    "entities": "SROIE2019/test/entities/X51005675099.txt"
  },
  "status": "unclear",
  "assignments": [
    {
      "id": "a001",
      "label": "TAX",
      "tokenIds": [
        "t0042"
      ],
      "text": "132.50"
    },
    {
      "id": "a002",
      "label": "GRAND_TOTAL",
      "tokenIds": [
        "t0044"
      ],
      "text": "132.50"
    },
    {
      "id": "a003",
      "label": "OTHER",
      "tokenIds": [
        "t0001",
        "t0002",
        "t0003",
        "t0004",
        "t0005",
        "t0006",
        "t0007",
        "t0008",
        "t0009",
        "t0010",
        "t0011",
        "t0012",
        "t0013",
        "t0014",
        "t0015",
        "t0016",
        "t0017",
        "t0018",
        "t0019",
        "t0020",
        "t0021",
        "t0022",
        "t0023",
        "t0024",
        "t0025",
        "t0026",
        "t0027",
        "t0028",
        "t0029",
        "t0030",
        "t0031",
        "t0032",
        "t0033",
        "t0034",
        "t0035",
        "t0036",
        "t0037",
        "t0038",
        "t0039",
        "t0040",
        "t0041",
        "t0043",
        "t0045",
        "t0046",
        "t0047",
        "t0048",
        "t0049",
        "t0050",
        "t0051",
        "t0052",
        "t0053",
        "t0054",
        "t0055"
      ],
      "text": "SUPER TERMINAL SDN BHD (1150024-H) TAX INVOICE NO. 18 & 19, TAMAN CITY, JALAN KUCHING, 52100 KUALA LUMPUR TEL: +603-6251 2293 GST ID NO: 000180269056 PLATE NO.: 1. LED 11 SIGNAL 1X55.00 58.30 SR 2. KZ SIGNAL CONDENSOR (KOZI) 12V (MODEL:SC1201)(MT) 1X18.00 19.08 SR - - 3. YAMLUBE (SEMI) MOTOR OIL 1 X 30.00 - 31.80 SR 4. OIL FILTER LC135 1 X 13.00 - 13.78 SR 5. BULB SIGNAL 12V8 RXZ G18.5 1 X 3.00 - 3.18 SR 6. NUMBER PLASTIC 6 X 1.00 - 6.36 SR TOTAL SALES INCLUSIVE GST @6% CASH CHANGE 0.00 GST SUMMARY AMOUNT(RM) TAX(RM) SR @ 6% 125.00 7.50 INV NO: CS-1801-00883DATE : 20/01/2018"
    }
  ],
  "items": [],
  "notes": "Geometry-and-math assisted annotation generated from original OCR boxes; no OCR text was invented. 0 item group(s); 0/0 item equations valid. lineSum=0.00; subtotal=missing; grandTotal=132.5. Needs human review because layout or totals were ambiguous.",
  "createdAt": "2026-09-11T00:44:23.827Z",
  "updatedAt": "2026-09-11T00:44:23.827Z"
}
