{
  "schemaVersion": 1,
  "receiptId": "X51007846403",
  "split": "test",
  "source": {
    "image": "SROIE2019/test/img/X51007846403.jpg",
    "boxes": "SROIE2019/test/box/X51007846403.txt",
    "entities": "SROIE2019/test/entities/X51007846403.txt"
  },
  "status": "unclear",
  "assignments": [
    {
      "id": "a001",
      "label": "ITEM_NAME",
      "tokenIds": [
        "t0026",
        "t0028"
      ],
      "text": "CHEESE MATCHA COLD",
      "itemId": "item-001"
    },
    {
      "id": "a002",
      "label": "QUANTITY",
      "tokenIds": [
        "t0025"
      ],
      "text": "1",
      "itemId": "item-001"
    },
    {
      "id": "a003",
      "label": "LINE_TOTAL",
      "tokenIds": [
        "t0029"
      ],
      "text": "13.10 SR",
      "itemId": "item-001"
    },
    {
      "id": "a004",
      "label": "SUBTOTAL",
      "tokenIds": [
        "t0032"
      ],
      "text": "13.10"
    },
    {
      "id": "a005",
      "label": "TAX",
      "tokenIds": [
        "t0045"
      ],
      "text": "0.00"
    },
    {
      "id": "a006",
      "label": "GRAND_TOTAL",
      "tokenIds": [
        "t0043"
      ],
      "text": "13.10"
    },
    {
      "id": "a007",
      "label": "OTHER",
      "tokenIds": [
        "t0001",
        "t0002",
        "t0003",
        "t0004",
        "t0005",
        "t0006",
        "t0007",
        "t0008",
        "t0009",
        "t0010",
        "t0011",
        "t0012",
        "t0013",
        "t0014",
        "t0015",
        "t0016",
        "t0017",
        "t0018",
        "t0019",
        "t0020",
        "t0021",
        "t0022",
        "t0023",
        "t0024",
        "t0027",
        "t0030",
        "t0031",
        "t0033",
        "t0034",
        "t0035",
        "t0036",
        "t0037",
        "t0038",
        "t0039",
        "t0040",
        "t0041",
        "t0042",
        "t0044",
        "t0046",
        "t0047"
      ],
      "text": "**ROYALTEA** (1237365-V) GST NO :000000241664 KSL CITY GF-S03B NO.33 , JALAN SELADANG TAMAN ABAD, 80250 JOHOR BAHRU, JOHOR,MALAYSIA. WIFI:ROYALTEA KSL PASSWORD:ROYALTEAS03B TAX INVOICE INVOICE NO : KSL001/26988 DATE : 02/06/2018 #1 2:57 PM CASHIER : ADMIN REF NO : 35 TA PRN ON : 02/06/2018 2:58 PM QTY ITEM RM *** RETAIL/TAKEAWAY *** 1 1 SUBTOTAL NET TOTAL 13.10 CASH 15.10 CHANGE 2.00 *** 02/06/2018 2:58 PM *** TAX SUMMARY SR:GST @0% AMOUNT TAX THANK YOU, PLEASE COME AGAIN GOODS SOLD ARE NON REFUNDABLE"
    }
  ],
  "items": [
    {
      "id": "item-001",
      "assignmentIds": [
        "a001",
        "a002",
        "a003"
      ]
    }
  ],
  "notes": "Geometry-and-math assisted annotation generated from original OCR boxes; no OCR text was invented. 1 item group(s); 0/1 item equations valid. lineSum=13.10; subtotal=13.1; grandTotal=13.1. Needs human review because layout or totals were ambiguous.",
  "createdAt": "2026-09-11T00:44:26.266Z",
  "updatedAt": "2026-09-11T00:44:26.266Z"
}
