{
  "schemaVersion": 1,
  "receiptId": "X51005361883",
  "split": "train",
  "source": {
    "image": "SROIE2019/train/img/X51005361883.jpg",
    "boxes": "SROIE2019/train/box/X51005361883.txt",
    "entities": "SROIE2019/train/entities/X51005361883.txt"
  },
  "status": "unclear",
  "assignments": [
    {
      "id": "a001",
      "label": "ITEM_NAME",
      "tokenIds": [
        "t0025"
      ],
      "text": "- JIANYU STELL RULER 30CM THICK",
      "itemId": "item-001"
    },
    {
      "id": "a002",
      "label": "QUANTITY",
      "tokenIds": [
        "t0021"
      ],
      "text": "1",
      "itemId": "item-001"
    },
    {
      "id": "a003",
      "label": "UNIT_PRICE",
      "tokenIds": [
        "t0023"
      ],
      "text": "5.69",
      "itemId": "item-001"
    },
    {
      "id": "a004",
      "label": "LINE_TOTAL",
      "tokenIds": [
        "t0024"
      ],
      "text": "3.30 *",
      "itemId": "item-001"
    },
    {
      "id": "a005",
      "label": "ITEM_NAME",
      "tokenIds": [
        "t0031"
      ],
      "text": "- LAMINATE FILM",
      "itemId": "item-002"
    },
    {
      "id": "a006",
      "label": "QUANTITY",
      "tokenIds": [
        "t0027"
      ],
      "text": "1",
      "itemId": "item-002"
    },
    {
      "id": "a007",
      "label": "UNIT_PRICE",
      "tokenIds": [
        "t0029"
      ],
      "text": "0.00",
      "itemId": "item-002"
    },
    {
      "id": "a008",
      "label": "LINE_TOTAL",
      "tokenIds": [
        "t0030"
      ],
      "text": "1.30 *",
      "itemId": "item-002"
    },
    {
      "id": "a009",
      "label": "ITEM_NAME",
      "tokenIds": [
        "t0035"
      ],
      "text": "SUB-TOTAL (EX)",
      "itemId": "item-003"
    },
    {
      "id": "a010",
      "label": "LINE_TOTAL",
      "tokenIds": [
        "t0037"
      ],
      "text": "4.60",
      "itemId": "item-003"
    },
    {
      "id": "a011",
      "label": "ITEM_NAME",
      "tokenIds": [
        "t0038"
      ],
      "text": "TOTAL TAX",
      "itemId": "item-004"
    },
    {
      "id": "a012",
      "label": "LINE_TOTAL",
      "tokenIds": [
        "t0040"
      ],
      "text": "0.28",
      "itemId": "item-004"
    },
    {
      "id": "a013",
      "label": "ROUNDING",
      "tokenIds": [
        "t0043"
      ],
      "text": "0.02"
    },
    {
      "id": "a014",
      "label": "GRAND_TOTAL",
      "tokenIds": [
        "t0049"
      ],
      "text": "4.90"
    },
    {
      "id": "a015",
      "label": "OTHER",
      "tokenIds": [
        "t0001",
        "t0002",
        "t0003",
        "t0004",
        "t0005",
        "t0006",
        "t0007",
        "t0008",
        "t0009",
        "t0010",
        "t0011",
        "t0012",
        "t0013",
        "t0014",
        "t0015",
        "t0016",
        "t0017",
        "t0018",
        "t0019",
        "t0020",
        "t0022",
        "t0026",
        "t0028",
        "t0032",
        "t0033",
        "t0034",
        "t0036",
        "t0039",
        "t0041",
        "t0042",
        "t0044",
        "t0045",
        "t0046",
        "t0047",
        "t0048",
        "t0050",
        "t0051",
        "t0052",
        "t0053",
        "t0054",
        "t0055",
        "t0056",
        "t0057",
        "t0058",
        "t0059",
        "t0060",
        "t0061",
        "t0062",
        "t0063",
        "t0064",
        "t0065",
        "t0066",
        "t0067",
        "t0068"
      ],
      "text": "TEO HENG STATIONERY & BOOKS (001451637-M) NO. 53, JALAN BESAR, 45600 BATANG BERJUNTAI SELANGOR DARUL EHSAN TEL : 03-3271 9872 FAX : 03-3271 9481 GST NO. : 000689913856 SIMPLIFIED TAX INVOICE CASH RECEIPT NO. : CS1801/26874 GOODS SOLD ARE NOT RETURNABLE, DATE : 18/01/2018 THANK YOU. ITEM QTY U/P DISC% AMOUNT (RM) 9557068000035 3.50 1 1.30 TOTAL QTY. : 2 4.60 : : ROUNDING : TOTAL : 4.90 CASH : CHANGE : 0.00 GST SUMMARY TAX CODE % AMOUNT TAX (RM) (RM) SR 6.00 4.60 0.28 TOTAL : 4.60 0.28 NOTE: (*) INDICATED THE ITEM SOLD HAS BEEN RELATED TO GST (GOODS & SERVICES TAX)."
    }
  ],
  "items": [
    {
      "id": "item-001",
      "assignmentIds": [
        "a001",
        "a002",
        "a003",
        "a004"
      ]
    },
    {
      "id": "item-002",
      "assignmentIds": [
        "a005",
        "a006",
        "a007",
        "a008"
      ]
    },
    {
      "id": "item-003",
      "assignmentIds": [
        "a009",
        "a010"
      ]
    },
    {
      "id": "item-004",
      "assignmentIds": [
        "a011",
        "a012"
      ]
    }
  ],
  "notes": "Geometry-and-math assisted annotation generated from original OCR boxes; no OCR text was invented. 4 item group(s); 0/4 item equations valid. lineSum=9.48; subtotal=missing; grandTotal=4.9. Needs human review because layout or totals were ambiguous.",
  "createdAt": "2026-09-11T00:44:26.621Z",
  "updatedAt": "2026-09-11T00:44:26.621Z"
}
