{
  "schemaVersion": 1,
  "receiptId": "X51005200938",
  "split": "train",
  "source": {
    "image": "SROIE2019/train/img/X51005200938.jpg",
    "boxes": "SROIE2019/train/box/X51005200938.txt",
    "entities": "SROIE2019/train/entities/X51005200938.txt"
  },
  "status": "unclear",
  "assignments": [
    {
      "id": "a001",
      "label": "ITEM_NAME",
      "tokenIds": [
        "t0025"
      ],
      "text": "SR: 11\" PROWESS H/DUTY SILICONE GUN G-D2",
      "itemId": "item-001"
    },
    {
      "id": "a002",
      "label": "QUANTITY",
      "tokenIds": [
        "t0022"
      ],
      "text": "1",
      "itemId": "item-001"
    },
    {
      "id": "a003",
      "label": "UNIT_PRICE",
      "tokenIds": [
        "t0023"
      ],
      "text": "15.00",
      "itemId": "item-001"
    },
    {
      "id": "a004",
      "label": "LINE_TOTAL",
      "tokenIds": [
        "t0024"
      ],
      "text": "15.00",
      "itemId": "item-001"
    },
    {
      "id": "a005",
      "label": "ITEM_NAME",
      "tokenIds": [
        "t0030"
      ],
      "text": "SR: XTRASEAL RTV ACETIC SILICONE SA-107",
      "itemId": "item-002"
    },
    {
      "id": "a006",
      "label": "QUANTITY",
      "tokenIds": [
        "t0027"
      ],
      "text": "3",
      "itemId": "item-002"
    },
    {
      "id": "a007",
      "label": "UNIT_PRICE",
      "tokenIds": [
        "t0028"
      ],
      "text": "7.00",
      "itemId": "item-002"
    },
    {
      "id": "a008",
      "label": "LINE_TOTAL",
      "tokenIds": [
        "t0029"
      ],
      "text": "21.00",
      "itemId": "item-002"
    },
    {
      "id": "a009",
      "label": "ITEM_NAME",
      "tokenIds": [
        "t0035"
      ],
      "text": "SR: CENTRAL PUNCH SET 3PCS - 1/4\",5/32\".1/4\"",
      "itemId": "item-003"
    },
    {
      "id": "a010",
      "label": "QUANTITY",
      "tokenIds": [
        "t0032"
      ],
      "text": "1",
      "itemId": "item-003"
    },
    {
      "id": "a011",
      "label": "UNIT_PRICE",
      "tokenIds": [
        "t0033"
      ],
      "text": "18.00",
      "itemId": "item-003"
    },
    {
      "id": "a012",
      "label": "LINE_TOTAL",
      "tokenIds": [
        "t0034"
      ],
      "text": "18.00",
      "itemId": "item-003"
    },
    {
      "id": "a013",
      "label": "ITEM_NAME",
      "tokenIds": [
        "t0040"
      ],
      "text": "SR. 24\" MARKSMAN PIPE WRENCH",
      "itemId": "item-004"
    },
    {
      "id": "a014",
      "label": "QUANTITY",
      "tokenIds": [
        "t0037"
      ],
      "text": "1",
      "itemId": "item-004"
    },
    {
      "id": "a015",
      "label": "UNIT_PRICE",
      "tokenIds": [
        "t0038"
      ],
      "text": "50.00",
      "itemId": "item-004"
    },
    {
      "id": "a016",
      "label": "LINE_TOTAL",
      "tokenIds": [
        "t0039"
      ],
      "text": "50.00",
      "itemId": "item-004"
    },
    {
      "id": "a017",
      "label": "ITEM_NAME",
      "tokenIds": [
        "t0045"
      ],
      "text": "SR: PVC WIRE TAPE 1PC X 7YD",
      "itemId": "item-005"
    },
    {
      "id": "a018",
      "label": "QUANTITY",
      "tokenIds": [
        "t0042"
      ],
      "text": "3",
      "itemId": "item-005"
    },
    {
      "id": "a019",
      "label": "UNIT_PRICE",
      "tokenIds": [
        "t0043"
      ],
      "text": "0.70",
      "itemId": "item-005"
    },
    {
      "id": "a020",
      "label": "LINE_TOTAL",
      "tokenIds": [
        "t0044"
      ],
      "text": "2.10",
      "itemId": "item-005"
    },
    {
      "id": "a021",
      "label": "ITEM_NAME",
      "tokenIds": [
        "t0046"
      ],
      "text": "TOT QTY:",
      "itemId": "item-006"
    },
    {
      "id": "a022",
      "label": "QUANTITY",
      "tokenIds": [
        "t0047"
      ],
      "text": "9",
      "itemId": "item-006"
    },
    {
      "id": "a023",
      "label": "LINE_TOTAL",
      "tokenIds": [
        "t0048"
      ],
      "text": "106.10",
      "itemId": "item-006"
    },
    {
      "id": "a024",
      "label": "TAX",
      "tokenIds": [
        "t0050"
      ],
      "text": "106.10"
    },
    {
      "id": "a025",
      "label": "DISCOUNT",
      "tokenIds": [
        "t0052"
      ],
      "text": "0.00"
    },
    {
      "id": "a026",
      "label": "ROUNDING",
      "tokenIds": [
        "t0056"
      ],
      "text": "-0.02"
    },
    {
      "id": "a027",
      "label": "GRAND_TOTAL",
      "tokenIds": [
        "t0060"
      ],
      "text": "112.45"
    },
    {
      "id": "a028",
      "label": "OTHER",
      "tokenIds": [
        "t0001",
        "t0002",
        "t0003",
        "t0004",
        "t0005",
        "t0006",
        "t0007",
        "t0008",
        "t0009",
        "t0010",
        "t0011",
        "t0012",
        "t0013",
        "t0014",
        "t0015",
        "t0016",
        "t0017",
        "t0018",
        "t0019",
        "t0020",
        "t0021",
        "t0026",
        "t0031",
        "t0036",
        "t0041",
        "t0049",
        "t0051",
        "t0053",
        "t0054",
        "t0055",
        "t0057",
        "t0058",
        "t0059",
        "t0061",
        "t0062",
        "t0063",
        "t0064",
        "t0065",
        "t0066",
        "t0067",
        "t0068",
        "t0069",
        "t0070",
        "t0071",
        "t0072",
        "t0073",
        "t0074",
        "t0075",
        "t0076"
      ],
      "text": "PERNIAGAAN ZHENG HUI JM0325955-V NO.59 JALAN PERMAS 9/5 BANDAR BARU PERMAS JAYA 81760 JOHOR BAHRU TEL : 07-386 7524 FAX : 07-386 3793 GST NO: 000800589824 SIMPLIFIED TAX INVOICE GOGIANT ENGINEERING (M) SDN BHD RECEIPT#: CS00082662 SALESPERSON: DATE: 12/02/2018 CASHIER: USER TIME:08:30:00 (RM) (RM) ITEM QTY RSP AMOUNT 8239 9555075109147 9744 12525 2016 (EXCLUDED GST) SUB TOTAL (RM) : DISCOUNT (RM) : TOTAL GST (RM) : 6.37 ROUNDING (RM) : TOTAL (RM) : 112.45 CASH : CHANGE (RM) : 0.00 GST SUMMARY TAX CODE % AMOUNT GST SR 6 106.10 6.37 TOTAL : 106.10 6.37 GOODS SOLD ARE NOT RETURNABLE. THANK YOU."
    }
  ],
  "items": [
    {
      "id": "item-001",
      "assignmentIds": [
        "a001",
        "a002",
        "a003",
        "a004"
      ]
    },
    {
      "id": "item-002",
      "assignmentIds": [
        "a005",
        "a006",
        "a007",
        "a008"
      ]
    },
    {
      "id": "item-003",
      "assignmentIds": [
        "a009",
        "a010",
        "a011",
        "a012"
      ]
    },
    {
      "id": "item-004",
      "assignmentIds": [
        "a013",
        "a014",
        "a015",
        "a016"
      ]
    },
    {
      "id": "item-005",
      "assignmentIds": [
        "a017",
        "a018",
        "a019",
        "a020"
      ]
    },
    {
      "id": "item-006",
      "assignmentIds": [
        "a021",
        "a022",
        "a023"
      ]
    }
  ],
  "notes": "Geometry-and-math assisted annotation generated from original OCR boxes; no OCR text was invented. 6 item group(s); 5/6 item equations valid. lineSum=212.20; subtotal=missing; grandTotal=112.45. Needs human review because layout or totals were ambiguous.",
  "createdAt": "2026-09-11T00:44:26.504Z",
  "updatedAt": "2026-09-11T00:44:26.504Z"
}
