{
  "schemaVersion": 1,
  "receiptId": "X51006387951",
  "split": "train",
  "source": {
    "image": "SROIE2019/train/img/X51006387951.jpg",
    "boxes": "SROIE2019/train/box/X51006387951.txt",
    "entities": "SROIE2019/train/entities/X51006387951.txt"
  },
  "status": "unclear",
  "assignments": [
    {
      "id": "a001",
      "label": "TAX",
      "tokenIds": [
        "t0031"
      ],
      "text": "RM0.17"
    },
    {
      "id": "a002",
      "label": "OTHER",
      "tokenIds": [
        "t0001",
        "t0002",
        "t0003",
        "t0004",
        "t0005",
        "t0006",
        "t0007",
        "t0008",
        "t0009",
        "t0010",
        "t0011",
        "t0012",
        "t0013",
        "t0014",
        "t0015",
        "t0016",
        "t0017",
        "t0018",
        "t0019",
        "t0020",
        "t0021",
        "t0022",
        "t0023",
        "t0024",
        "t0025",
        "t0026",
        "t0027",
        "t0028",
        "t0029",
        "t0030",
        "t0032",
        "t0033",
        "t0034"
      ],
      "text": "AMANO MALAYSIA SDN BHD (682288-V) 12 JALAN PENGACARA U1/48 TEMASYA INDUSTRIAL PARK 40150 SHAH ALAM SELANGOR TEL: 03-55695002/5003 (GST ID: 001137704960) TAX INVOICE P/S #02 RM3.00 A INV-NO.0002300417000138 T/D #11 TICKET NO.029190 ENTRY TIME PAID TIME PARKING TIME 30/04/2017 (SUN) 19:44 30/04/2017 (SUN) 23:14 RM3.00 RM0.00 THANK YOU INCLUSIVE 6% GST 3:30 TYPE RATE A RM3.00 PARKING FEE GST(INCLUDED) 6.00 % RM2.83 TOTAL PAID CHANGE"
    }
  ],
  "items": [],
  "notes": "Geometry-and-math assisted annotation generated from original OCR boxes; no OCR text was invented. 0 item group(s); 0/0 item equations valid. lineSum=0.00; subtotal=missing; grandTotal=missing. Needs human review because layout or totals were ambiguous.",
  "createdAt": "2026-09-11T00:44:28.750Z",
  "updatedAt": "2026-09-11T00:44:28.750Z"
}
