{
  "schemaVersion": 1,
  "receiptId": "X51007135037",
  "split": "train",
  "source": {
    "image": "SROIE2019/train/img/X51007135037.jpg",
    "boxes": "SROIE2019/train/box/X51007135037.txt",
    "entities": "SROIE2019/train/entities/X51007135037.txt"
  },
  "status": "unclear",
  "assignments": [
    {
      "id": "a001",
      "label": "ITEM_NAME",
      "tokenIds": [
        "t0024",
        "t0026"
      ],
      "text": "LION FILE 6'S SPRING FILE MFF350",
      "itemId": "item-001"
    },
    {
      "id": "a002",
      "label": "QUANTITY",
      "tokenIds": [
        "t0027"
      ],
      "text": "50",
      "itemId": "item-001"
    },
    {
      "id": "a003",
      "label": "UNIT_PRICE",
      "tokenIds": [
        "t0028"
      ],
      "text": "1.60",
      "itemId": "item-001"
    },
    {
      "id": "a004",
      "label": "LINE_TOTAL",
      "tokenIds": [
        "t0029"
      ],
      "text": "80.00",
      "itemId": "item-001"
    },
    {
      "id": "a005",
      "label": "GRAND_TOTAL",
      "tokenIds": [
        "t0038"
      ],
      "text": "72.00"
    },
    {
      "id": "a006",
      "label": "TAX",
      "tokenIds": [
        "t0036"
      ],
      "text": "72.00"
    },
    {
      "id": "a007",
      "label": "DISCOUNT",
      "tokenIds": [
        "t0032"
      ],
      "text": "-8.00"
    },
    {
      "id": "a008",
      "label": "OTHER",
      "tokenIds": [
        "t0001",
        "t0002",
        "t0003",
        "t0004",
        "t0005",
        "t0006",
        "t0007",
        "t0008",
        "t0009",
        "t0010",
        "t0011",
        "t0012",
        "t0013",
        "t0014",
        "t0015",
        "t0016",
        "t0017",
        "t0018",
        "t0019",
        "t0020",
        "t0021",
        "t0022",
        "t0023",
        "t0025",
        "t0030",
        "t0031",
        "t0033",
        "t0034",
        "t0035",
        "t0037",
        "t0039",
        "t0040",
        "t0041",
        "t0042",
        "t0043",
        "t0044",
        "t0045",
        "t0046",
        "t0047",
        "t0048",
        "t0049"
      ],
      "text": "S&Y STATIONERY (002050590-H) NO.36G JALAN BULAN BM U5/BM, BANDAR PINGGIRAN SUBANG, SEKSYEN U5, 40150 SHAH ALAM, SELANGOR. TEL / FAX : 0163307491 / 0378317491 EMAIL: SNYSTATIONERY@HOTMAIL.COM TEL: 0163307491 / 0378317491 FAX: 0378317491 E-MAIL: SNYSTATIONERY@HOTMAIL,.COM (GST REG NO : 000906854400) S/P : SALES INV NO : CS-0004323 05-JAN-2017 03:17:50 PM INVOICE NO. DESCRIPTION UOM CODE QTY U/PRICE TOTAL(MYR) 1 PCS SR DISCOUNT @10.00% ITEM COUNT : 50 TOTAL SALES INCL. GST @6% : TOTAL AMOUNT PAYABLE : CASH RECEIVED : 100.00 CHANGE : 28.00 GST SUMMARY AMOUNT (MYR) TAX (MYR) SR = 6% 67.92 4.08 GOODS SOLD ARE NOT RETURNABLE/REFUNDABLE"
    }
  ],
  "items": [
    {
      "id": "item-001",
      "assignmentIds": [
        "a001",
        "a002",
        "a003",
        "a004"
      ]
    }
  ],
  "notes": "Geometry-and-math assisted annotation generated from original OCR boxes; no OCR text was invented. 1 item group(s); 1/1 item equations valid. lineSum=80.00; subtotal=missing; grandTotal=72. Needs human review because layout or totals were ambiguous.",
  "createdAt": "2026-09-11T00:44:30.401Z",
  "updatedAt": "2026-09-11T00:44:30.401Z"
}
