{
  "schemaVersion": 1,
  "receiptId": "X51005230617",
  "split": "train",
  "source": {
    "image": "SROIE2019/train/img/X51005230617.jpg",
    "boxes": "SROIE2019/train/box/X51005230617.txt",
    "entities": "SROIE2019/train/entities/X51005230617.txt"
  },
  "status": "unclear",
  "assignments": [
    {
      "id": "a001",
      "label": "ITEM_NAME",
      "tokenIds": [
        "t0018"
      ],
      "text": "2 CHICMCMUFFIN",
      "itemId": "item-001"
    },
    {
      "id": "a002",
      "label": "LINE_TOTAL",
      "tokenIds": [
        "t0028"
      ],
      "text": "11.00",
      "itemId": "item-001"
    },
    {
      "id": "a003",
      "label": "ITEM_NAME",
      "tokenIds": [
        "t0019"
      ],
      "text": "1 M PORRIDGE",
      "itemId": "item-002"
    },
    {
      "id": "a004",
      "label": "LINE_TOTAL",
      "tokenIds": [
        "t0029"
      ],
      "text": "5.60",
      "itemId": "item-002"
    },
    {
      "id": "a005",
      "label": "ITEM_NAME",
      "tokenIds": [
        "t0020"
      ],
      "text": "1 BM 2HOTCAKES",
      "itemId": "item-003"
    },
    {
      "id": "a006",
      "label": "LINE_TOTAL",
      "tokenIds": [
        "t0030"
      ],
      "text": "10.00",
      "itemId": "item-003"
    },
    {
      "id": "a007",
      "label": "TAX",
      "tokenIds": [
        "t0031"
      ],
      "text": "26.60"
    },
    {
      "id": "a008",
      "label": "GRAND_TOTAL",
      "tokenIds": [
        "t0032"
      ],
      "text": "26.60"
    },
    {
      "id": "a009",
      "label": "OTHER",
      "tokenIds": [
        "t0001",
        "t0002",
        "t0003",
        "t0004",
        "t0005",
        "t0006",
        "t0007",
        "t0008",
        "t0009",
        "t0010",
        "t0011",
        "t0012",
        "t0013",
        "t0014",
        "t0015",
        "t0016",
        "t0017",
        "t0021",
        "t0022",
        "t0023",
        "t0024",
        "t0025",
        "t0026",
        "t0027",
        "t0033",
        "t0034",
        "t0035",
        "t0036",
        "t0037",
        "t0038",
        "t0039",
        "t0040",
        "t0041",
        "t0042",
        "t0043"
      ],
      "text": "1950 GERBANG ALAF RESTAURANTS SDN BHD (65351-M) FORMERLY KNOWN AS GOLDEN ARCHES RESTAURANTS SDN BHD LICENSEE OF MCDONALD'S LEVEL 6, BANGUNAN TH, DAMANSARA UPTOWN3 NO.3, JALAN SS21/39,47400 PETALING JAYA SELANGOR (GST ID NO: 000504664064) MCDONALD'S BHP TAMAN MELAWATI(#328) TEL NO. 03-4162-2318 TAX INVOICE MFY SIDE 1 INV# 003281900229170 ORD #50 -REG #19- 18/01/2018 10:27:03 QTY ITEM 1 L COKE TAKEOUT TOTAL (INCL GST) TOTAL ROUNDED CASH TENDERED CHANGE TOTAL INCLUDES 6% GST TOTAL 100.00 73.40 1.51 WE'D LOVE TO HEAR YOUR FEEDBACK SIT WWW.MCDFEEDBACK.COM.MY OR DOWNLOAD MY MCD FEEDBACK FROM GOOGLE PLAY/APP STORE TO SHARE YOUR EXPERIENCE THANK YOU AND PLEASE COME AGAIN. CUSTOMER SERVICE HOTLINE : 03-2726-5600"
    }
  ],
  "items": [
    {
      "id": "item-001",
      "assignmentIds": [
        "a001",
        "a002"
      ]
    },
    {
      "id": "item-002",
      "assignmentIds": [
        "a003",
        "a004"
      ]
    },
    {
      "id": "item-003",
      "assignmentIds": [
        "a005",
        "a006"
      ]
    }
  ],
  "notes": "Geometry-and-math assisted annotation generated from original OCR boxes; no OCR text was invented. 3 item group(s); 0/3 item equations valid. lineSum=26.60; subtotal=missing; grandTotal=26.6. Needs human review because layout or totals were ambiguous.",
  "createdAt": "2026-09-11T00:44:26.512Z",
  "updatedAt": "2026-09-11T00:44:26.512Z"
}
