{
  "schemaVersion": 1,
  "receiptId": "X51005806703",
  "split": "train",
  "source": {
    "image": "SROIE2019/train/img/X51005806703.jpg",
    "boxes": "SROIE2019/train/box/X51005806703.txt",
    "entities": "SROIE2019/train/entities/X51005806703.txt"
  },
  "status": "unclear",
  "assignments": [
    {
      "id": "a001",
      "label": "ITEM_NAME",
      "tokenIds": [
        "t0021",
        "t0022"
      ],
      "text": "POLY CHOPPING BOARD - 013 3 UNIT *",
      "itemId": "item-001"
    },
    {
      "id": "a002",
      "label": "UNIT_PRICE",
      "tokenIds": [
        "t0024"
      ],
      "text": "0.00",
      "itemId": "item-001"
    },
    {
      "id": "a003",
      "label": "LINE_TOTAL",
      "tokenIds": [
        "t0025"
      ],
      "text": "14.40",
      "itemId": "item-001"
    },
    {
      "id": "a004",
      "label": "ITEM_NAME",
      "tokenIds": [
        "t0027",
        "t0028"
      ],
      "text": "PLASTIC BOWL - 2.80 8 UNIT *",
      "itemId": "item-002"
    },
    {
      "id": "a005",
      "label": "UNIT_PRICE",
      "tokenIds": [
        "t0030"
      ],
      "text": "0.00",
      "itemId": "item-002"
    },
    {
      "id": "a006",
      "label": "LINE_TOTAL",
      "tokenIds": [
        "t0031"
      ],
      "text": "22.40",
      "itemId": "item-002"
    },
    {
      "id": "a007",
      "label": "ITEM_NAME",
      "tokenIds": [
        "t0033",
        "t0034"
      ],
      "text": "PLASTIC CONTAINER W COVER MS-SQ-1 6 UNIT *",
      "itemId": "item-003"
    },
    {
      "id": "a008",
      "label": "UNIT_PRICE",
      "tokenIds": [
        "t0036"
      ],
      "text": "0.00",
      "itemId": "item-003"
    },
    {
      "id": "a009",
      "label": "LINE_TOTAL",
      "tokenIds": [
        "t0037"
      ],
      "text": "9.00",
      "itemId": "item-003"
    },
    {
      "id": "a010",
      "label": "ITEM_NAME",
      "tokenIds": [
        "t0039",
        "t0040"
      ],
      "text": "BENXON PP HYGIENIC CUP-AO-700 22 OZ-50PCS 1 UNIT *",
      "itemId": "item-004"
    },
    {
      "id": "a011",
      "label": "QUANTITY",
      "tokenIds": [
        "t0041"
      ],
      "text": "10.00",
      "itemId": "item-004"
    },
    {
      "id": "a012",
      "label": "UNIT_PRICE",
      "tokenIds": [
        "t0042"
      ],
      "text": "0.00",
      "itemId": "item-004"
    },
    {
      "id": "a013",
      "label": "LINE_TOTAL",
      "tokenIds": [
        "t0043"
      ],
      "text": "10.00",
      "itemId": "item-004"
    },
    {
      "id": "a014",
      "label": "ITEM_NAME",
      "tokenIds": [
        "t0045",
        "t0046"
      ],
      "text": "STAEDTLER LUNA COLOUR PENCIL 11 UNIT *",
      "itemId": "item-005"
    },
    {
      "id": "a015",
      "label": "UNIT_PRICE",
      "tokenIds": [
        "t0048"
      ],
      "text": "0.00",
      "itemId": "item-005"
    },
    {
      "id": "a016",
      "label": "LINE_TOTAL",
      "tokenIds": [
        "t0049"
      ],
      "text": "53.90",
      "itemId": "item-005"
    },
    {
      "id": "a017",
      "label": "TAX",
      "tokenIds": [
        "t0057"
      ],
      "text": "109.70"
    },
    {
      "id": "a018",
      "label": "ROUNDING",
      "tokenIds": [
        "t0058"
      ],
      "text": "0.00"
    },
    {
      "id": "a019",
      "label": "GRAND_TOTAL",
      "tokenIds": [
        "t0060"
      ],
      "text": "109.70"
    },
    {
      "id": "a020",
      "label": "OTHER",
      "tokenIds": [
        "t0001",
        "t0002",
        "t0003",
        "t0004",
        "t0005",
        "t0006",
        "t0007",
        "t0008",
        "t0009",
        "t0010",
        "t0011",
        "t0012",
        "t0013",
        "t0014",
        "t0015",
        "t0016",
        "t0017",
        "t0018",
        "t0019",
        "t0020",
        "t0023",
        "t0026",
        "t0029",
        "t0032",
        "t0035",
        "t0038",
        "t0044",
        "t0047",
        "t0050",
        "t0051",
        "t0052",
        "t0053",
        "t0054",
        "t0055",
        "t0056",
        "t0059",
        "t0061",
        "t0062",
        "t0063",
        "t0064",
        "t0065",
        "t0066",
        "t0067"
      ],
      "text": "CASH SALE SINNATHAMBY HOLDINGS SDN. BHD. (249336-T) NO.17,18 & 41,JALAN BESAR, 39100 BRINCHANG, CAMERON HIGHLANDS, PAHANG GST REG.:002120876032 DOCUMENT NO. DATE : T04-18/084227 : 06/02/2018 07:09:46 PM DESC QTY PRICE RM DISC AMOUNT RM TAX CODE 4.80 SR 2.80 SR 1.50 SR SR 4.90 SR TOTAL QTY: 29 TOTAL INCLUSIVE GST 6% : ROUNDING ADJUSTMENT : ROUNDED TOTAL (RM): CASH 109.70 GST SUMMARY SR @ 6 % AMOUNT(RM) 103.49 TAX(RM) 6.21 ~~~ THANKS YOU ~~~"
    }
  ],
  "items": [
    {
      "id": "item-001",
      "assignmentIds": [
        "a001",
        "a002",
        "a003"
      ]
    },
    {
      "id": "item-002",
      "assignmentIds": [
        "a004",
        "a005",
        "a006"
      ]
    },
    {
      "id": "item-003",
      "assignmentIds": [
        "a007",
        "a008",
        "a009"
      ]
    },
    {
      "id": "item-004",
      "assignmentIds": [
        "a010",
        "a011",
        "a012",
        "a013"
      ]
    },
    {
      "id": "item-005",
      "assignmentIds": [
        "a014",
        "a015",
        "a016"
      ]
    }
  ],
  "notes": "Geometry-and-math assisted annotation generated from original OCR boxes; no OCR text was invented. 5 item group(s); 0/5 item equations valid. lineSum=109.70; subtotal=missing; grandTotal=109.7. Needs human review because layout or totals were ambiguous.",
  "createdAt": "2026-09-11T00:44:28.383Z",
  "updatedAt": "2026-09-11T00:44:28.383Z"
}
