{
  "schemaVersion": 1,
  "receiptId": "X51007339122",
  "split": "test",
  "source": {
    "image": "SROIE2019/test/img/X51007339122.jpg",
    "boxes": "SROIE2019/test/box/X51007339122.txt",
    "entities": "SROIE2019/test/entities/X51007339122.txt"
  },
  "status": "unclear",
  "assignments": [
    {
      "id": "a001",
      "label": "TAX",
      "tokenIds": [
        "t0024"
      ],
      "text": "8.70"
    },
    {
      "id": "a002",
      "label": "DISCOUNT",
      "tokenIds": [
        "t0025"
      ],
      "text": "0.00"
    },
    {
      "id": "a003",
      "label": "ROUNDING",
      "tokenIds": [
        "t0027"
      ],
      "text": "0.00"
    },
    {
      "id": "a004",
      "label": "GRAND_TOTAL",
      "tokenIds": [
        "t0028"
      ],
      "text": "8.70"
    },
    {
      "id": "a005",
      "label": "OTHER",
      "tokenIds": [
        "t0001",
        "t0002",
        "t0003",
        "t0004",
        "t0005",
        "t0006",
        "t0007",
        "t0008",
        "t0009",
        "t0010",
        "t0011",
        "t0012",
        "t0013",
        "t0014",
        "t0015",
        "t0016",
        "t0017",
        "t0018",
        "t0019",
        "t0020",
        "t0021",
        "t0022",
        "t0023",
        "t0026",
        "t0029",
        "t0030",
        "t0031",
        "t0032",
        "t0033",
        "t0034",
        "t0035",
        "t0036",
        "t0037",
        "t0038",
        "t0039",
        "t0040",
        "t0041",
        "t0042",
        "t0043",
        "t0044",
        "t0045",
        "t0046"
      ],
      "text": "SANYU STATIONERY SHOP NO. 31G&33G, JALAN SETIA INDAH X ,U13/X 40170 SETIA ALAM MOBILE /WHATSAPPS : +6012-918 7937 TEL: +603-3362 4137 GST ID NO: 001531760640 TAX INVOICE OWNED BY : SANYU SUPPLY SDN BHD (1135772-K) CASH SALES COUNTER 1. 2012-0029 3 X 2.9000 RESTAURANT ORDER CHIT NCR 3.5\"X6\" 8.70 SR TOTAL SALES INCLUSIVE GST @6% DISCOUNT TOTAL ROUND ADJ FINAL TOTAL CASH CHANGE 8.70 20.00 11.30 GST SUMMARY AMOUNT(RM) TAX(RM) SR @ 6% 8.21 0.49 INV NO: CS-SA-0117906 DATE : 14/10/2017 GOODS SOLD ARE NOT RETURNABLE & REFUNDABLE THANK YOU FOR YOUR PATRONAGE PLEASE COME AGAIN. TERIMA KASIH SILA DATANG LAGI ** PLEASE KEEP THIS RECEIPT FOR PROVE OF PURCHASE DATE FOR I.T PRODUCT WARRANTY PURPOSE ** FOLLOW US IN FACEBOOK : SANYU.STATIONERY"
    }
  ],
  "items": [],
  "notes": "Geometry-and-math assisted annotation generated from original OCR boxes; no OCR text was invented. 0 item group(s); 0/0 item equations valid. lineSum=0.00; subtotal=missing; grandTotal=8.7. Needs human review because layout or totals were ambiguous.",
  "createdAt": "2026-09-11T00:44:25.934Z",
  "updatedAt": "2026-09-11T00:44:25.934Z"
}
